{
  "$schema": "https://json-schema.org/draft/2020-12/schema",
  "$id": "reservation-file",
  "type": "object",
  "required": ["schema", "job", "token", "created_at", "placement", "extra", "template"],
  "properties": {
    "schema": { "const": 3 },
    "job": { "anyOf": [{ "$ref": "defs#/$defs/job" }, { "type": "null" }], "description": "null for a spawn with no job." },
    "token": { "type": "string", "pattern": "^[0-9a-f]{32}$", "description": "Random; ends the file name, and is passed to the launch as SESSHIN_TOKEN." },
    "created_at": { "$ref": "defs#/$defs/timestamp" },
    "placement": { "$ref": "defs#/$defs/placement", "description": "The launched window; null until the launch returns." },
    "extra": { "type": "object", "description": "The adopting session's extra (User-owned extra); {} from resume." },
    "template": { "anyOf": [{ "$ref": "defs#/$defs/template-name" }, { "type": "null" }], "description": "The adopting session's template; null for a spawn with none, and from resume." }
  },
  "additionalProperties": false
}
